<?xml version="1.0" ?>
<!DOCTYPE plans SYSTEM "http://www.matsim.org/files/dtd/plans_v4.dtd">
<plans>
<person id="1">
	<plan>
		<act type="h" x="-25000" y="0" link="1" end_time="06:00" />
		<leg mode="car">
			<route>2 7 12</route>
		</leg>
		<act type="w" x="10000" y="0" link="20" dur="00:10" />
		<leg mode="car">
			<route> </route>
		</leg>
		<act type="w" x="10000" y="0" link="20" dur="03:30" />
		<leg mode="car">
			<route>13 14 15 1</route>
		</leg>
		<act type="h" x="-25000" y="0" link="1" />
	</plan>
</person>
</plans>